{
  "station_id": "gs-tw-01",
  "location": {
    "lat": 24.78,
    "lon": 120.99,
    "alt_m": 50,
    "country_code": "TW"
  },
  "supported_bands": ["Ka", "Ku"],
  "beam_profiles": [
    {
      "beam_id": "beam-1",
      "band": "Ka",
      "boresight_az_deg": 120.0,
      "boresight_el_deg": 45.0,
      "hpbw_deg": 3.5,
      "max_eirp_dbw": 55.0
    },
    {
      "beam_id": "beam-2",
      "band": "Ka",
      "boresight_az_deg": 150.0,
      "boresight_el_deg": 50.0,
      "hpbw_deg": 3.5,
      "max_eirp_dbw": 55.0
    },
    {
      "beam_id": "beam-3",
      "band": "Ka",
      "boresight_az_deg": 180.0,
      "boresight_el_deg": 35.0,
      "hpbw_deg": 3.5,
      "max_eirp_dbw": 55.0
    }
  ],
  "gateway_profiles": [
    { "gateway_id": "gateway-pod-1", "role": "primary", "throughput_mbps": 500 },
    { "gateway_id": "gateway-pod-2", "role": "backup", "throughput_mbps": 300 }
  ],
  "observability_endpoints": {
    "prometheus_url": "http://prometheus.orbitops.svc.cluster.local:9090",
    "grafana_url": "http://grafana.orbitops.svc.cluster.local:3000"
  }
}
